{
  "schemaVersion": 1,
  "planId": "plan-capability-profiles-v1",
  "scopeDigest": "sha256:aaaaaaaaaaaaaaaaaaaaaaaaaaaaaaaaaaaaaaaaaaaaaaaaaaaaaaaaaaaaaaaa",
  "authorityDigest": "sha256:bbbbbbbbbbbbbbbbbbbbbbbbbbbbbbbbbbbbbbbbbbbbbbbbbbbbbbbbbbbbbbbb",
  "createdAt": "2026-07-13T06:10:00Z",
  "expiresAt": "2026-07-20T06:10:00Z",
  "chair": {
    "agentId": "chair",
    "role": "chair-and-synthesis",
    "provider": "codex",
    "family": "openai",
    "model": null,
    "routeIntent": "flagship",
    "effort": "xhigh",
    "authorityProfile": "review-readonly",
    "parentAgentId": null
  },
  "agents": [
    {
      "agentId": "contract-writer",
      "role": "contract-and-test-writer",
      "provider": "claude",
      "family": "anthropic",
      "model": null,
      "routeIntent": "workhorse",
      "effort": "high",
      "authorityProfile": "workspace-write-offline",
      "parentAgentId": "chair"
    },
    {
      "agentId": "compiler-implementer",
      "role": "authority-compiler-implementer",
      "provider": "codex",
      "family": "openai",
      "model": null,
      "routeIntent": "flagship",
      "effort": "high",
      "authorityProfile": "workspace-write-offline",
      "parentAgentId": "chair"
    },
    {
      "agentId": "codex-adapter",
      "role": "codex-adapter-specialist",
      "provider": "codex",
      "family": "openai",
      "model": null,
      "routeIntent": "flagship",
      "effort": "high",
      "authorityProfile": "workspace-write-offline",
      "parentAgentId": "chair"
    },
    {
      "agentId": "claude-adapter",
      "role": "claude-adapter-specialist",
      "provider": "claude",
      "family": "anthropic",
      "model": null,
      "routeIntent": "flagship",
      "effort": "high",
      "authorityProfile": "workspace-write-offline",
      "parentAgentId": "chair"
    },
    {
      "agentId": "integrator",
      "role": "integration-owner",
      "provider": "codex",
      "family": "openai",
      "model": null,
      "routeIntent": "workhorse",
      "effort": "high",
      "authorityProfile": "workspace-write-offline",
      "parentAgentId": "chair"
    },
    {
      "agentId": "native-reviewer",
      "role": "fresh-native-reviewer",
      "provider": "codex",
      "family": "openai",
      "model": null,
      "routeIntent": "flagship",
      "effort": "high",
      "authorityProfile": "review-readonly",
      "parentAgentId": "chair"
    },
    {
      "agentId": "cross-reviewer",
      "role": "other-primary-security-reviewer",
      "provider": "claude",
      "family": "anthropic",
      "model": null,
      "routeIntent": "flagship",
      "effort": "high",
      "authorityProfile": "review-readonly",
      "parentAgentId": "chair"
    }
  ],
  "tasks": [
    {
      "taskId": "T1",
      "title": "Freeze provider admission, permission and recovery contracts",
      "ownerAgentId": "contract-writer",
      "dependencies": [],
      "writeScope": {
        "mode": "worktree",
        "paths": [
          "runtime/agent-fabric/tests/**",
          "proposed schemas/fixtures"
        ],
        "worktree": ".worktrees/capability-contracts"
      },
      "returnContract": [
        "failing current-gap fixtures",
        "conformance matrix",
        "test rationale"
      ],
      "completionCriteria": [
        "current read-only posture characterised",
        "write and escape fixtures defined"
      ],
      "stopConditions": [
        "scope requires network or external effects",
        "provider schema is unavailable"
      ]
    },
    {
      "taskId": "T2",
      "title": "Implement neutral authority compiler and profile stores",
      "ownerAgentId": "compiler-implementer",
      "dependencies": [
        "T1"
      ],
      "writeScope": {
        "mode": "worktree",
        "paths": [
          "runtime/agent-fabric/src/authority/**",
          "runtime/agent-fabric/src/providers/ports.ts"
        ],
        "worktree": ".worktrees/authority-compiler"
      },
      "returnContract": [
        "implementation patch",
        "unit/property tests",
        "decision receipt fields"
      ],
      "completionCriteria": [
        "subset rules pass",
        "current read-only profile is equivalent"
      ],
      "stopConditions": [
        "requires broad public API change",
        "transaction invariant becomes unclear"
      ]
    },
    {
      "taskId": "T3",
      "title": "Compile profiles to Codex App Server",
      "ownerAgentId": "codex-adapter",
      "dependencies": [
        "T2"
      ],
      "writeScope": {
        "mode": "worktree",
        "paths": [
          "runtime/agent-fabric/src/adapters/providers/codex-app-server.ts",
          "Codex adapter tests"
        ],
        "worktree": ".worktrees/codex-profile"
      },
      "returnContract": [
        "adapter patch",
        "native settings snapshots",
        "conformance results"
      ],
      "completionCriteria": [
        "read-only and offline write profiles compile",
        "broader payloads rejected"
      ],
      "stopConditions": [
        "provider cannot enforce offline write",
        "unsupported native API version"
      ]
    },
    {
      "taskId": "T4",
      "title": "Compile profiles to Claude Agent SDK",
      "ownerAgentId": "claude-adapter",
      "dependencies": [
        "T2"
      ],
      "writeScope": {
        "mode": "worktree",
        "paths": [
          "runtime/agent-fabric/src/adapters/providers/claude-agent-sdk.ts",
          "Claude adapter tests"
        ],
        "worktree": ".worktrees/claude-profile"
      },
      "returnContract": [
        "adapter patch",
        "native settings snapshots",
        "conformance results"
      ],
      "completionCriteria": [
        "read-only and offline write profiles compile",
        "broader payloads rejected"
      ],
      "stopConditions": [
        "provider cannot enforce offline write",
        "unsupported native API version"
      ]
    },
    {
      "taskId": "T5",
      "title": "Extract provider-action command handling and integrate profiles",
      "ownerAgentId": "integrator",
      "dependencies": [
        "T1",
        "T2",
        "T3",
        "T4"
      ],
      "writeScope": {
        "mode": "worktree",
        "paths": [
          "runtime/agent-fabric/src/core/fabric.ts",
          "runtime/agent-fabric/src/providers/**",
          "integration tests"
        ],
        "worktree": ".worktrees/capability-integration"
      },
      "returnContract": [
        "integrated patch",
        "deleted old path",
        "full receipts",
        "verification report"
      ],
      "completionCriteria": [
        "one transaction authority retained",
        "recovery and full gates pass",
        "no compatibility path"
      ],
      "stopConditions": [
        "receipt semantics change unexpectedly",
        "ambiguous action cannot be reconciled"
      ]
    }
  ],
  "integration": {
    "ownerAgentId": "integrator",
    "strategy": "serial-apply",
    "targetWorktree": ".worktrees/capability-integration"
  },
  "verification": {
    "deterministicGates": [
      "schema-check",
      "typecheck",
      "unit",
      "integration",
      "acceptance",
      "provider-conformance",
      "fault-injection",
      "security-path-network-effect-boundaries",
      "full-clean-checkout"
    ],
    "cleanCheckout": true,
    "liveGates": [
      "bounded-Codex-smoke",
      "bounded-Claude-smoke"
    ]
  },
  "review": {
    "policyClass": "highRisk",
    "reviewers": [
      {
        "agentId": "native-reviewer",
        "independence": {
          "freshContext": true,
          "differentAuthor": true,
          "familyDistinct": false
        },
        "lens": [
          "correctness",
          "recovery",
          "maintainability"
        ]
      },
      {
        "agentId": "cross-reviewer",
        "independence": {
          "freshContext": true,
          "differentAuthor": true,
          "familyDistinct": true
        },
        "lens": [
          "security",
          "provider-parity",
          "authority-escalation"
        ]
      }
    ],
    "repairCycles": 2
  },
  "budgets": {
    "provider_calls": 80,
    "turns": 120,
    "wall_clock_minutes": 480,
    "review_cycles": 2
  },
  "replanConditions": [
    "provider cannot enforce offline workspace write",
    "authority profile requires network",
    "state or receipt semantics would change",
    "tasks require overlapping write ownership",
    "budget forecast exceeds the approved ceiling"
  ],
  "externalEffects": []
}
